<?xml version="1.0" encoding="UTF-8"?>
<Types xmlns:xsi="http://www.w3.org/2001/XMLSchema-instance" xsi:noNamespaceSchemaLocation="..\tools\types.xsd">
	<ObjectType name="BaseDTO" category="Base" id="1a81bc99-28c2-4c03-ac5c-a1de4967cc36">
		<Base name="" category=""/>
		<PropertyType name="Id" type="UuId"/>
		<PropertyType name="Type" type="UuId"/>
	</ObjectType>
	<ObjectType name="PropertyDTO" category="Base" id="24ef4fd2-e337-4baa-89dd-404a72200871">
		<Base name="" category=""/>
		<PropertyType name="Name" type="String"/>
		<PropertyType name="Value" type="String"/>
	</ObjectType>
	<ObjectType name="ObjectDTO" category="Base" id="1a81bc99-28c2-4c03-ac5c-a1de4967cc36">
		<Base name="BaseDTO" category="Base"/>
		<PropertyType name="Properties" type="PropertyDTO[]"/>
	</ObjectType>
	<ObjectType name="TypeDTO" category="Base" id="2c8c1feb-0d04-45d2-bbe7-fe137450412e">
		<Base name="BaseDTO" category="Base"/>
		<PropertyType name="Name" type="String"/>
	</ObjectType>
	<!-- <ObjectType name="DatatypeDTO" id="91d670c8-dedd-41c9-8407-7532b1fad45a">
		<Base name="" />
		<PropertyType name="Type" type="Enum=String,Boolean,Double,Int32,*DTO"/>
	</ObjectType> -->
</Types>
