<?xml version="1.0" encoding="UTF-8"?>
<!--Sample XML file generated by XMLSpy v2018 rel. 2 sp1 (x64) (http://www.altova.com)-->
<Types xmlns:xsi="http://www.w3.org/2001/XMLSchema-instance" xsi:noNamespaceSchemaLocation="..\tools\types.xsd">
	<ObjectType name="PropertyDTO" category="Base" id="24ef4fd2-e337-4baa-89dd-404a72200871">
		<PropertyType name="Name" type="String"/>
		<PropertyType name="Type" type="String"/>
		<PropertyType name="Value" type="String"/>
	</ObjectType>
	<ObjectType name="BaseDTO" category="Base" id="1a81bc99-28c2-4c03-ac5c-a1de4967cc36">
		<Base name="" category=""/>
		<PropertyType name="Id" type="UuId"/>
		<PropertyType name="Type" type="UuId"/>
		<PropertyType name="Properties" type="PropertyDTO[]"/>
	</ObjectType>
	<ObjectType name="TypeDTO" category="Base" id="2c8c1feb-0d04-45d2-bbe7-fe137450412e">
		<Base name="BaseDTO" category="Base"/>
	</ObjectType>
	<ObjectType name="TextDTO" category="Types" id="69082378-4fae-4bf5-adfc-ddecfbdf4bb5">
		<Base name="TypeDTO" category="Base"/>
		<PropertyType name="Encoding" type="String"/>
		<PropertyType name="MaxLength" type="UInt64"/>
	</ObjectType>
</Types>
