<?xml version="1.0" encoding="UTF-8"?>
<!--Sample XML file generated by XMLSpy v2018 rel. 2 sp1 (x64) (http://www.altova.com)-->
<Types
	xmlns:xsi="http://www.w3.org/2001/XMLSchema-instance" xsi:noNamespaceSchemaLocation="..\tools\types.xsd">
	<ObjectType name="CommandDTO" category="Types" id="c1eda1fc-cc45-4658-889f-ccd989c2848a">
		<Summary>         Base command object. Has all arguments in generig list,          can be derived by concrete command types         </Summary>
		<Base name="BaseDTO" category="Base"/>
		<PropertyType name="Response" type="Boolean" default="false" summary="Indicates if this is the answer"/>
		<PropertyType name="Arguments" type="PropertyDTO[]" summary="Arguments of the command"/>
	</ObjectType>
	<ObjectType name="SampleCommandDTO" category="Samples" id="e3e185bd-5237-4574-977f-a040bbe12d35">
		<Base name="CommandDTO" category="Types" />
		<PropertyType name="FirstOne" type="String" fromList="Arguments"></PropertyType>
		<PropertyType name="SecondOne" type="Boolean" fromList="Arguments"></PropertyType>
	</ObjectType>
</Types>
